<?xml version="1.0" encoding="UTF-8"?>
<!-- Revision: Dec 21st 2022 -->
<!-- W3C Schema generated by XMLSpy v2018 rel. 2 (x64) (http://www.altova.com) -->
<xs:schema xmlns:xs="http://www.w3.org/2001/XMLSchema">
	<xs:element name="NUTS">
		<xs:complexType>
			<xs:sequence>
				<xs:element ref="CNTRY" maxOccurs="unbounded"/>
			</xs:sequence>
		</xs:complexType>
	</xs:element>
	<xs:element name="CNTRY">
		<xs:complexType>
			<xs:sequence>
				<xs:element ref="REGION" maxOccurs="unbounded"/>
			</xs:sequence>
			<xs:attribute name="id" use="required">
				<xs:simpleType>
					<xs:restriction base="xs:string">
						<xs:pattern value="[A-Z]{2}"/>
					</xs:restriction>
				</xs:simpleType>
			</xs:attribute>
			<xs:attribute name="desc" use="optional">
				<xs:simpleType>
					<xs:restriction base="xs:string"/>
				</xs:simpleType>
			</xs:attribute>
		</xs:complexType>
	</xs:element>
	<xs:element name="REGION">
		<xs:complexType>
			<xs:attribute name="id" use="required">
				<xs:simpleType>
					<xs:restriction base="xs:string"/>
				</xs:simpleType>
			</xs:attribute>
			<xs:attribute name="start" type="xs:integer" use="optional"/>
			<xs:attribute name="end" type="xs:integer" use="optional"/>
			<xs:attribute name="desc" type="xs:string" use="optional"/>
		</xs:complexType>
	</xs:element>
</xs:schema>
